{
  "schema_version": "1.0.0",
  "id": "lego-batman-3-beyond-gotham.selftest-batman-container-2026-10-04",
  "slug": "lego-batman-3-beyond-gotham",
  "game": {
    "title": "LEGO Batman 3: Beyond Gotham",
    "exe": "LEGOBatman3.exe",
    "steam_appid": 313690,
    "gamehub_id": 160159,
    "aliases": [
      "LEGOBatman3"
    ]
  },
  "target": {
    "app": "gamehub",
    "package_name": "com.xiaoji.egggame",
    "app_version_note": "6.3.1"
  },
  "device": {
    "manufacturer": "REDMAGIC",
    "model": "NX799J",
    "soc": "Snapdragon 8 Elite",
    "gpu": "Adreno 830",
    "ram_gb": 16,
    "android_version": "16",
    "notes": "REDMAGIC 11 Air (SM8750)."
  },
  "settings": {
    "wine_or_proton": "proton10.0-arm64x-2",
    "dxvk_version": "dxvk-v2.4.1-async",
    "cpu_translator": "Fex-20260103",
    "translator_preset": "Custom",
    "gpu_driver": "turnip_v26.1.0_b8",
    "extra": {
      "container": "Batman: Arkham Asylum GOTY (GameHub id 156707)",
      "launch_via": "0lego.bat",
      "launch_via_aliases": [
        "bm_lego.bat",
        "lego_run.bat"
      ],
      "launch_from": "Batman tile → PC Game Settings → Container → Enter virtual desktop → My Computer → (D:)",
      "fex": "Custom/TSO (Batman container). Session summary also wrote this DXVK as 2.4.1-async and this driver as Turnip v26.1.0_b8.",
      "not_settings": [
        "TU_DEBUG=noubwc was added to 0lego.bat / lego_run_noubwc.bat and never confirmed",
        "Turnip_Gen8_V26 was not tested on this path",
        "Proton version was not changed on this path"
      ]
    }
  },
  "verification": {
    "status": "verified",
    "performance": "intro 60 FPS, textures scrambled",
    "average_fps": "60",
    "notes": "Nick Moody phone self-test, 2026-10-04 ~21:02 ET. This is the failed path inside Batman's container, not the working Local Game import. Intro rendered at 60 FPS, CPU 11%, GPU 72%, with texture scrambling (characters, icons, and backgrounds cut into blocks and reshuffled). Launch 0lego.bat (same as bm_lego.bat / lego_run.bat) from (D:) inside the virtual desktop. Container stack used: Proton 10.0-arm64x-2, DXVK 2.4.1-async (launch log name dxvk-v2.4.1-async), Turnip v26.1.0_b8 (turnip_v26.1.0_b8), FEX Custom/TSO starting from Fex-20260103. Airplane mode was not tested.",
    "known_issues": [
      "Texture scrambling survived Turnip b8 → b6, FEX Fex-20260103 → Fex_20260913, and DXVK 2.4.1-async → 2.3.1-async. Proton 11 + default Game Presets on the Local Game tile did not show this on title, planet, and button icons.",
      "Run program with the same script fails: DxvkInstance::createInstance: Failed to create Vulkan 1.1 instance. Only the virtual desktop launch worked.",
      "Turnip_Gen8_V26, a Proton change, and TU_DEBUG=noubwc were not confirmed on this path"
    ]
  },
  "provenance": {
    "source_type": "self_test",
    "source_url": "https://github.com/coolkidnick/moodygamer-recipes",
    "source_id": "selftest-batman-container-2026-10-04",
    "author": "Nick Moody",
    "captured_at": "2026-10-04",
    "license_note": "Owner tests by Nick Moody on 2026-10-04. Distinct from EmuReady community listings for this title."
  },
  "tags": [
    "virtual-desktop",
    "epic",
    "redmagic-11-air",
    "batman-container"
  ]
}
